{
  "repo": "sentrux",
  "captured_at": "2026-04-12T10:39:05.161Z",
  "source_report": "docs/v2/examples/sentrux-review-packet.md",
  "source_feedback": "Maintainer-curated verdicts for the Sentrux review packet plus seeded self-defect and remediation artifacts. Replay-backed large_file watchpoints stay present, and direct seeded verdicts now cover the under-evidenced rule, obligation, clone, and zero-config signals.",
  "verdicts": [
    {
      "scope": "sentrux-core/src/metrics/v2/mod.rs",
      "kind": "large_file",
      "report_bucket": "Metrics Hotspots",
      "category": "useful",
      "expected_trust_tier": "watchpoint",
      "expected_presentation_class": "structural_debt",
      "expected_leverage_class": "local_refactor_target",
      "expected_summary_presence": "headline",
      "preferred_over": [
        "sentrux-core/src/app/mcp_server/handlers/agent_format.rs"
      ],
      "engineer_note": "This module recurs across multiple replay scenarios and is the clearest concentrated metrics maintenance surface. Keep it ahead of isolated handler helpers when large-file pressure needs triage.",
      "expected_v2_behavior": "Keep this near the top of the maintainer summary as a replay-backed refactor target, but still frame it as a watchpoint until non-size evidence is stronger."
    },
    {
      "scope": "sentrux-core/src/app/mcp_server/handlers.rs",
      "kind": "large_file",
      "report_bucket": "Handler Boundaries",
      "category": "useful",
      "expected_trust_tier": "watchpoint",
      "expected_presentation_class": "structural_debt",
      "expected_leverage_class": "architecture_signal",
      "expected_summary_presence": "headline",
      "preferred_over": [
        "sentrux-core/src/app/mcp_server/handlers/test_support.rs"
      ],
      "engineer_note": "A 3.6k-line handler entry surface is more important than adjacent support-file growth because it indicates boundary aggregation pressure in the MCP server layer.",
      "expected_v2_behavior": "Surface this as a headline architecture watchpoint and rank it above narrower support-file large-file findings from the same replay family."
    },
    {
      "scope": "sentrux-core/src/app/mcp_server/handlers/session.rs",
      "kind": "large_file",
      "report_bucket": "Clone Followthrough Watchpoints",
      "category": "useful_watchpoint",
      "expected_trust_tier": "watchpoint",
      "expected_presentation_class": "structural_debt",
      "expected_leverage_class": "local_refactor_target",
      "expected_summary_presence": "section_present",
      "preferred_over": [
        "sentrux-core/src/app/mcp_server/handlers/test_support.rs"
      ],
      "engineer_note": "This file sits on the session-introduced-clone replay path, so it is a better followthrough watchpoint than generic handler support code growth.",
      "expected_v2_behavior": "Keep this visible as a clone-followthrough watchpoint without overstating it as direct clone evidence."
    },
    {
      "scope": "sentrux-core/src/app/mcp_server/handlers/classification.rs",
      "kind": "large_file",
      "report_bucket": "Handler Boundaries",
      "category": "useful_watchpoint",
      "expected_trust_tier": "watchpoint",
      "expected_presentation_class": "structural_debt",
      "expected_leverage_class": "secondary_cleanup",
      "expected_summary_presence": "section_present",
      "preferred_over": [
        "sentrux-core/src/app/mcp_server/handlers/agent_format.rs"
      ],
      "engineer_note": "The classification handler is materially larger than nearby formatting helpers and is a more credible contained cleanup target inside the same boundary family.",
      "expected_v2_behavior": "Keep this in the maintainer packet as secondary cleanup and do not let smaller nearby handler files outrank it."
    },
    {
      "scope": "sentrux-core/src/metrics/v2/clones.rs",
      "kind": "large_file",
      "report_bucket": "Clone Followthrough Watchpoints",
      "category": "useful_watchpoint",
      "expected_trust_tier": "watchpoint",
      "expected_presentation_class": "structural_debt",
      "expected_leverage_class": "regrowth_watchpoint",
      "expected_summary_presence": "section_present",
      "preferred_over": [
        "sentrux-core/src/app/mcp_server/handlers/agent_format.rs"
      ],
      "engineer_note": "This is the only replay-backed large-file sample directly sitting on the clone-priority scenario surface, so it should stay visible even though the replay still failed to emit explicit clone kinds.",
      "expected_v2_behavior": "Keep this present as a clone-adjacent watchpoint, but do not promote it to trusted clone evidence until replay or live runs emit the expected clone signal kinds."
    },
    {
      "scope": "src/components/SidebarTaskRow.tsx",
      "kind": "forbidden_raw_read",
      "report_bucket": "Seeded Boundary Discipline",
      "category": "useful",
      "expected_trust_tier": "trusted",
      "expected_presentation_class": "boundary_discipline",
      "expected_leverage_class": "boundary_discipline",
      "expected_summary_presence": "headline",
      "preferred_over": [
        "sentrux-core/src/metrics/v2/mod.rs"
      ],
      "engineer_note": "The seeded self-defect and successful remediation both confirm that this raw-read pattern is actionable direct boundary evidence, not just adjacent structural debt.",
      "expected_v2_behavior": "Promote this as trusted boundary-discipline evidence when the same projection bypass pattern appears in live or replay runs."
    },
    {
      "scope": "scripts/defect-injection/catalog.mjs",
      "kind": "incomplete_propagation",
      "report_bucket": "Seeded Boundary Discipline",
      "category": "useful",
      "expected_trust_tier": "trusted",
      "expected_presentation_class": "boundary_discipline",
      "expected_leverage_class": "architecture_signal",
      "expected_summary_presence": "headline",
      "preferred_over": [
        "sentrux-core/src/app/mcp_server/handlers.rs"
      ],
      "engineer_note": "This seeded contract-surface miss reproduced cleanly and remediated cleanly, so it should count as direct propagation evidence instead of leaving the scorecard dependent on large-file stand-ins.",
      "expected_v2_behavior": "Keep this near the top of the maintainer summary as trusted propagation evidence whenever sibling contract surfaces drift."
    },
    {
      "scope": "src/copy.ts",
      "kind": "session_introduced_clone",
      "report_bucket": "Seeded Clone Followthrough",
      "category": "useful_watchpoint",
      "expected_trust_tier": "watchpoint",
      "expected_presentation_class": "duplication_pressure",
      "expected_leverage_class": "local_refactor_target",
      "expected_summary_presence": "section_present",
      "preferred_over": [
        "sentrux-core/src/app/mcp_server/handlers/session.rs"
      ],
      "engineer_note": "The self-defect shows direct post-baseline duplicate introduction and the remediation clears it cleanly, so this is better clone evidence than replay-only large-file followthrough.",
      "expected_v2_behavior": "Keep this visible as direct clone followthrough evidence while still framing it as a watchpoint until live sessions clear the same pattern reliably."
    },
    {
      "scope": "src/app/task-dashboard.ts",
      "kind": "zero_config_boundary_violation",
      "report_bucket": "Seeded Zero-Config Watchpoints",
      "category": "useful_watchpoint",
      "expected_trust_tier": "watchpoint",
      "expected_presentation_class": "boundary_discipline",
      "expected_leverage_class": "boundary_discipline",
      "expected_summary_presence": "section_present",
      "preferred_over": [
        "sentrux-core/src/metrics/v2/mod.rs"
      ],
      "engineer_note": "This seeded deep-import violation gives Sentrux a concrete zero-config boundary sample with both detection and remediation evidence, which was previously missing from the maintained review set.",
      "expected_v2_behavior": "Keep this as a maintained watchpoint and use it to validate zero-config boundary ranking against large-file crowd-out."
    }
  ]
}
